{
	"type": "not-things_timeseq_script",
	"version": "0.0.1",
	"timelines": [
		{
			"lanes": [
				{
					"auto-start": false,
					"loop": false,
					"start-trigger": "determine-output",
					"segments": [
						{
							"duration": { "millis": 500 },
							"actions": [
								{
									"timing": "start",
									"set-variable": {
										"name": "bernoulli-chance",
										"value": {
											"rand": {
												"lower": { "voltage": 0 },
												"upper": { "voltage": 10 }
											}
										}
									}
								},
								{
									"timing": "start",
									"set-value": {
										"output": { "index": 3 },
										"value": { "variable": "bernoulli-chance" }
									}
								},
								{
									"timing": "start",
									"if": {
										"gt": [
											{ "variable": "bernoulli-chance" },
											{ "voltage": 5 }
										]
									},
									"set-value": {
										"output": { "index": 1 },
										"value": { "voltage": 10 }
									}
								},
								{
									"timing": "start",
									"if": {
										"lte": [
											{ "variable": "bernoulli-chance" },
											{ "voltage": 5 }
										]
									},
									"set-value": {
										"output": { "index": 2 },
										"value": { "voltage": 10 }
									}
								}
							]
						},
						{
							"duration": { "samples": 1 },
							"actions": [
								{
									"timing": "start",
									"set-value": {
										"output": { "index": 1 },
										"value": { "voltage": 0 }
									}
								},
								{
									"timing": "start",
									"set-value": {
										"output": { "index": 2 },
										"value": { "voltage": 0 }
									}
								}
							]
						}
					]
				}
			]
		}
	],
	"input-triggers": [
		{
			"id": "determine-output",
			"input": { "index": 1 }
		}
	]
}
